{
  "hardware": {
    "serial_port": "/dev/tty.usbserial-0001",
    "baud_rate": 115200,
    "brightness_min": 1,
    "brightness_max": 255
  },
  "staircase": {
    "start_value": 128,
    "step_sizes": [32, 16, 8, 4, 2, 1],
    "n_up": 1,
    "n_down": 1,
    "n_trials": 100,
    "n_reversals": 10,
    "step_type": "lin",
    "apply_initial_rule": true
  },
  "timing": {
    "pre_stimulus_delay": 6.0,
    "stimulus_duration": 2.0,
    "inter_trial_interval": 6.0
  },
  "paths": {
    "data_directory": "~/Documents/Calibration/data",
    "log_directory": "~/Documents/Calibration/logs",
    "config_directory": "~/Documents/Calibration/config"
  },
  "data": {
    "threshold_reversals": 6
  }
}